{
  "case_id": "HARNESS.POSITIVE",
  "description": "Behavior-neutral C000 runner contract fixture",
  "environment": {
    "clock": {
      "mode": "fixed",
      "unix_millis": 1700000000000
    },
    "filesystem_order": "unsigned-byte-lexicographic",
    "locale": "C.UTF-8",
    "network": "disabled",
    "random_seed": "0000000000000000000000000000000000000000000000000000000000000000",
    "timezone": "UTC"
  },
  "expected": {
    "error": null,
    "events": [
      {
        "fields": {
          "ordered": 1
        },
        "kind": "harness.event",
        "sequence": 0
      }
    ],
    "exit_code": 0,
    "logs": [
      {
        "fields": {
          "message": "deterministic"
        },
        "kind": "harness.log",
        "sequence": 0
      }
    ],
    "output": {
      "presence": "present",
      "value": {
        "bytes": {
          "encoding": "hex-lower",
          "value": "00ff"
        },
        "presence_example": {
          "presence": "null"
        }
      }
    },
    "state_deltas": [
      {
        "after": {
          "presence": "present",
          "value": {
            "encoding": "hex-lower",
            "value": "02"
          }
        },
        "before": {
          "presence": "absent"
        },
        "key": {
          "encoding": "hex-lower",
          "value": "01"
        },
        "sequence": 0,
        "store": "harness"
      }
    ],
    "status": "ok"
  },
  "identity": {
    "fixture_revision": "c000-v1",
    "generator": {
      "name": "c000-fixture-author",
      "version": "1"
    },
    "java_source_revision": "df50ce9676b94de0b10a605076adfd8728811384",
    "schema_id": "urn:java-tron-rust:oracle:fixture:v1"
  },
  "initial_state": [],
  "input": {
    "operation": "protocol_skeleton"
  },
  "normalizations": [],
  "oracle_class": "harness",
  "schema_version": 1,
  "tags": [
    "c000",
    "protocol-skeleton"
  ]
}
